doi,abstract
10.1101/000042,"We are entering the era of ubiquitous genetic information for research, clinical care, and personal curiosity. Sharing these datasets is vital for rapid progress in understanding the genetic basis of human diseases. However, one growing concern is the ability to protect the genetic privacy of the data originators. Here, we technically map threats to genetic privacy and discuss potential mitigation strategies for privacy-preserving dissemination of genetic data.\n\nAbout the AuthorsYaniv Erlich is a Fellow at the Whitehead Institute for Biomedical Research. Erlich received his Ph.D. from Cold Spring Harbor Laboratory in 2010 and B.Sc. from Tel-Aviv University in 2006. Prior to that, Erlich worked in computer security and was responsible for conducting penetration tests on financial institutes and commercial companies. Dr. Erlichs research involves developing new algorithms for computational human genetics.\n\nArvind Narayanan is an Assistant Professor in the Department of Computer Science and the Center for Information Technology and Policy at Princeton. He studies information privacy and security. His research has shown that data anonymization is broken in fundamental ways, for which he jointly received the 2008 Privacy Enhancing Technologies Award. His current research interests include building a platform for privacy-preserving data sharing.\n\nSummaryO_LIBroad data dissemination is essential for advancements in genetics, but also brings to light concerns regarding privacy.\nC_LIO_LIPrivacy breaching techniques work by cross-referencing two or more pieces of information to gain new, potentially undesirable knowledge on individuals or their families.\nC_LIO_LIBroadly speaking, the main routes to breach privacy are identity tracing, attribute disclosure, and completion of sensitive DNA information.\nC_LIO_LIIdentity tracing exploits quasi-identifiers in the DNA data or metadata to uncover the identity of an unknown genetic dataset.\nC_LIO_LIAttribute disclosure techniques work on known DNA datasets. They use the DNA information to link the identity of a person with a sensitive phenotype.\nC_LIO_LICompletion techniques also work on known DNA data. They try to uncover sensitive genomic areas that were masked to protect the participant.\nC_LIO_LIIn the last few years, we have witnessed a rapid growth in the range of techniques and tools to conduct these privacy-breaching attacks. Currently, most of the techniques are beyond the reach of the general public, but can be executed by trained persons with varying degrees of effort.\nC_LIO_LIThere is considerable debate regarding risk management. One camp supports a pragmatic, ad-hoc approach of privacy by obscurity and the other supports a systematic, mathematically-backed approach of privacy by design.\nC_LIO_LIPrivacy by design algorithms include access control, differential privacy, and cryptographic techniques. So far, data custodians of genetic databases mainly adopted access control as a mitigation strategy.\nC_LIO_LINew developments in cryptographic techniques may usher in an additional arsenal of security by design techniques.\nC_LI"
10.1101/000802,"An approach for generating high-resolution a priori maximum parsimony Y-chromosome (chrY) phylogenies based on SNP and small INDEL variant data from massively-parallel short-read (next-generation) sequencing data is described; the tree-generation methodology produces annotations localizing mutations to individual branches of the tree, along with indications of mutation placement uncertainty in cases for which \""no-calls\"" (through lack of mapped reads or otherwise) at particular site precludes a precise placement of the mutation. The approach leverages careful variant site filtering and a novel iterative reweighting procedure to generate high-accuracy trees while considering variants in regions of chrY that had previously been excluded from analyses based on short-read sequencing data. It is argued that the proposed approach is also superior to previous region-based filtering approaches in that it adapts to the quality of the underlying data and will automatically allow the scope of sites considered to expand as the underlying data quality improves (e.g. through longer read lengths). Key related issues, including calling of genotypes for the hemizygous chrY, reliability of variant results, read mismappings and \""heterozygous\"" genotype calls, and the mutational stability of different variants are discussed and taken into account. The methodology is demonstrated through application to a dataset consisting of 1292 male samples from diverse populations and haplogroups, with the majority coming from low-coverage sequencing by the 1000 Genomes Project. Application of the tree-generation approach to these data produces a tree involving over 120,000 chrY variant sites (about 45,000 sites if singletons are excluded). The utility of this approach in refining the Y-chromosome phylogenetic tree is demonstrated by examining results for several haplogroups. The results indicate a number of new branches on the Y-chromosome phylogenetic tree, many of them subdividing known branches, but also including some that inform the presence of additional levels along the trunk of the tree. Finally, opportunities for extensions of this phylogenetic analysis approach to other types of genetic data are examined."
10.1101/001388,"Genomics is increasingly being used to investigate disease outbreaks, but an important question remains unanswered - how well do genomic data capture known transmission events, particularly for pathogens with long carriage periods or large within-host population sizes? Here we present a novel Bayesian approach to reconstruct densely-sampled outbreaks from genomic data whilst considering within-host diversity. We infer a time-labelled phylogeny using BEAST, then infer a transmission network via a Monte-Carlo Markov Chain. We find that under a realistic model of within-host evolution, reconstructions of simulated outbreaks contain substantial uncertainty even when genomic data reflect a high substitution rate. Reconstruction of a real-world tuberculosis outbreak displayed similar uncertainty, although the correct source case and several clusters of epidemiologically linked cases were identified. We conclude that genomics cannot wholly replace traditional epidemiology, but that Bayesian reconstructions derived from sequence data may form a useful starting point for a genomic epidemiology investigation."
10.1101/001479,"Recent advances in sequencing technology have helped unveil the unexpected complexity and diversity of small RNAs. A critical step in small RNA library preparation for sequencing is the ligation of adapter sequences to both the 5 and 3 ends of small RNAs. Two widely used protocols for small RNA library preparation, Illumina v1.5 and Illumina TruSeq, use different pairs of adapter sequences. In this study, we compare the results of small RNA-sequencing between v1.5 and TruSeq and observe a striking differential bias. Nearly 100 highly expressed microRNAs (miRNAs) are >5-fold differentially detected and 48 miRNAs are >10-fold differentially detected between the two methods of library preparation. In fact, some miRNAs, such as miR-24-3p, are over 30-fold differentially detected. The results are reproducible across different sequencing centers (NIH and UNC) and both major Illumina sequencing platforms, GAIIx and HiSeq. While some level of bias in library preparation is not surprising, the apparent massive differential bias between these two widely used adapter sets is not well appreciated. As increasingly more laboratories transition to the newer TruSeq-based library preparation for small RNAs, researchers should be aware of the extent to which the results may differ from previously published results using v1.5."
10.1101/001511,"The additive genetic effect is arguably the most important quantity inferred in animal and plant breeding analyses. The term effect indicates that it represents causal information, which is different from standard statistical concepts as regression coefficient and association. The process of inferring causal information is also different from standard statistical learning, as the former requires causal (i.e. non-statistical) assumptions and involves extra complexities. Remarkably, the task of inferring genetic effects is largely seen as a standard regression/prediction problem, contradicting its label. This widely accepted analysis approach is by itself insufficient for causal learning, suggesting that causality is not the point for selection. Given this incongruence, it is important to verify if genomic predictors need to represent causal effects to be relevant for selection decisions, especially because applying regression studies to answer causal questions may lead to wrong conclusions. The answer to this question defines if genomic selection models should be constructed aiming maximum genomic predictive ability or aiming identifiability of genetic causal effects. Here, we demonstrate that selection relies on a causal effect from genotype to phenotype, and that genomic predictors are only useful for selection if they distinguish such effect from other sources of association. Conversely, genomic predictors capturing non-causal signals provide information that is less relevant for selection regardless of the resulting predictive ability. Focusing on covariate choice decision, simulated examples are used to show that predictive ability, which is the criterion normally used to compare models, may not indicate the quality of genomic predictors for selection. Additionally, we propose using alternative criteria to construct models aiming for the identification of the genetic causal effects."
10.1101/000026,"Adaptation in response to selection on polygenic phenotypes occurs via subtle allele frequencies shifts at many loci. Current population genomic techniques are not well posed to identify such signals. In the past decade, detailed knowledge about the specific loci underlying polygenic traits has begun to emerge from genome-wide association studies (GWAS). Here we combine this knowledge from GWAS with robust population genetic modeling to identify traits that have undergone local adaptation. Using GWAS data, we estimate the mean additive genetic value for a give phenotype across many populations as simple weighted sums of allele frequencies. We model the expected differentiation of GWAS loci among populations under neutrality to develop simple tests of selection across an arbitrary number of populations with arbitrary population structure. To find support for the role of specific environmental variables in local adaptation we test for correlations with the estimated genetic values. We also develop a general test of local adaptation to identify overdispersion of the estimated genetic values values among populations. This test is a natural generalization of QST /FST comparisons based on GWAS predictions. Finally we lay out a framework to identify the individual populations or groups of populations that contribute to the signal of overdispersion. These tests have considerably greater power than their single locus equivalents due to the fact that they look for positive covariance between like effect alleles. We apply our tests to the human genome diversity panel dataset using GWAS data for six different traits. This analysis uncovers a number of putative signals of local adaptation, and we discuss the biological interpretation and caveats of these results."
10.1101/000257,"The study of human mobility is both of fundamental importance and of great potential value. For example, it can be leveraged to facilitate efficient city planning and improve prevention strategies when faced with epidemics. The newfound wealth of rich sources of data--including banknote flows, mobile phone records, and transportation data--have led to an explosion of attempts to characterize modern human mobility. Unfortunately, the dearth of comparable historical data makes it much more difficult to study human mobility patterns from the past. In this paper, we present such an analysis: we demonstrate that the data record from Korean family books (called \""jokbo\"") can be used to estimate migration patterns via marriages from the past 750 years. We apply two generative models of long-term human mobility to quantify the relevance of geographical information to human marriage records in the data, and we find that the wide variety in the geographical distributions of the clans poses interesting challenges for the direct application of these models. Using the different geographical distributions of clans, we quantify the \""ergodicity\"" of clans in terms of how widely and uniformly they have spread across Korea, and we compare these results to those obtained using surname data from the Czech Republic. To examine population flow in more detail, we also construct and examine a population-flow network between regions. Based on the correlation between ergodicity and migration patterns in Korea, we identify two different types of migration patterns: diffusive and convective. We expect the analysis of diffusive versus convective effects in population flows to be widely applicable to the study of mobility and migration patterns across different cultures."
10.1101/000414,"There are significant differences in the biology of males and females, ranging from biochemical pathways to behavioural responses, which are relevant to modern medicine. Broad-sense heritability estimates differ between the sexes for many common medical disorders, indicating that genetic architecture can be sex-dependent. Recent genome-wide association studies (GWAS) have successfully identified sex-specific and sex-biased effects, where in addition to sex-specific effects on gene expression, twenty-two medical traits have sex-specific or sex-biased loci. Sex-specific genetic architecture of complex traits is also extensively documented in model organisms using genome-wide linkage or association mapping, and in gene disruption studies. The evolutionary origins of sex-specific genetic architecture and sexual dimorphism lie in the fact that males and females share most of their genetic variation yet experience different selection pressures. At the extreme is sexual antagonism, where selection on an allele acts in opposite directions between the sexes. Sexual antagonism has been repeatedly identified via a number of experimental methods in a range of different taxa. Although the molecular basis remains to be identified, mathematical models predict the maintenance of deleterious variants that experience selection in a sex-dependent manner. There are multiple mechanisms by which sexual antagonism and alleles under sex-differential selection could contribute toward the genetics of common, complex disorders. The evidence we review clearly indicates that further research into sex-dependent selection and the sex-specific genetic architecture of diseases would be rewarding. This would be aided by studies of laboratory and wild animal populations, and by modelling sex-specific effects in genome-wide association data with joint, gene-by-sex interaction tests. We predict that even sexually monomorphic diseases may harbour cryptic sex-specific genetic architecture. Furthermore, empirical evidence suggests that investigating sex-dependent epistasis may be especially rewarding. Finally, the prevalent nature of sex-specific genetic architecture in disease offers scope for the development of more effective, sex-specific therapies.\n\nFundingThis work was supported by the European Research Council (WPG and EHM; Starting Grant #280632), a Royal Society University Research Fellowship (EHM), the Swedish Research Council (JKA), and the Volkswagen Foundation (JKA). The funders had no role in study design, data collection and analysis, decision to publish, or preparation of the manuscript.\n\nCompeting interestsThe authors declare that they have no competing financial interests."
10.1101/000687,"Introduction Introduction Clinical classifications and the... De novo mutations, germline... Rare and compensatory mutations Current ability / approaches Prenatal diagnosis,... Implications for acceptance,... Conclusions References \""our incomplete studies do not permit actual classification; but it is better to leave things by themselves rather than to force them into classes which have their foundation only on paper\"" -- Edouard Seguin (Seguin, 1866)\n\n\""The fundamental mistake which vitiates all work based upon Mendels method is the neglect of ancestry, and the attempt to regard the whole effect upon offspring, produced by a particular parent, as due to the existence in the parent of particular structural c ..."
10.1101/001073,"Tools for estimating population structure from genetic data are now used in a wide variety of applications in population genetics. However, inferring population structure in large modern data sets imposes severe computational challenges. Here, we develop efficient algorithms for approximate inference of the model underlying the STRUCTURE program using a variational Bayesian framework. Variational methods pose the problem of computing relevant posterior distributions as an optimization problem, allowing us to build on recent advances in optimization theory to develop fast inference tools. In addition, we propose useful heuristic scores to identify the number of populations represented in a dataset and a new hierarchical prior to detect weak population structure in the data. We test the variational algorithms on simulated data, and illustrate using genotype data from the CEPH-Human Genome Diversity Panel. The variational algorithms are almost two orders of magnitude faster than STRUCTURE and achieve accuracies comparable to those of ADMIXTURE. Furthermore, our results show that the heuristic scores for choosing model complexity provide a reasonable range of values for the number of populations represented in the data, with minimal bias towards detecting structure when it is very weak. Our algorithm, fastSTRUCTURE, is freely available online at http://pritchardlab.stanford.edu/structure.html."
10.1101/001099,"Hemifacial microsomia (HFM) is the second most common facial anomaly after cleft lip and palate. The phenotype is highly variable and most cases are sporadic. Here, we investigated the disorder in a large pedigree with five affected individuals spanning eight meioses. We performed whole-exome sequencing and a genome-wide survey of segmental variations. Analysis of the exome sequencing results indicated the absence of a pathogenic coding point mutation. Inspection of segmental variations identified a 1.3Mb duplication of chromosome 14q22.3 in all affected individuals that was absent in more than 1000 chromosomes of ethnically matched controls. The duplication was absent in seven additional sporadic HFM cases, which is concordant with the known heterogeneity of the disorder. To find the critical gene in the duplicated region, we analyzed signatures of human craniofacial disease networks, mouse expression data, and predictions of dosage sensitivity. All of these approaches implicated OTX2 as the most likely causal gene. Moreover, OTX2 is a known oncogenic driver in medulloblastoma, a condition that was diagnosed in the proband during the course of our study. Our findings highlight dosage sensitivity of OTX2 in human craniofacial development and suggest a possible shared etiology between a subtype of hemifacial microsomia and medulloblastoma."
10.1101/001354,"The debate over the ethnogenesis of Ashkenazi Jewry is longstanding, and has been hampered by a lack of Jewish historiographical work between the Biblical and the early Modern eras. Most historians, as well as geneticists, situate them as the descendants of Israelite tribes whose presence in Europe is owed to deportations during the Roman conquest of Palestine, as well as migration from Babylonia, and eventual settlement along the Rhine. By contrast, a few historians and other writers, most famously Arthur Koestler, have looked to migrations following the decline of the little-understood Medieval Jewish kingdom of Khazaria as the main source for Ashkenazi Jewry. A recent study of genetic variation in southeastern European populations (Elhaik 2012) also proposed a Khazarian origin for Ashkenazi Jews, eliciting considerable criticism from other scholars investigating Jewish ancestry who favor a Near Eastern origin of Ashkenazi populations. This paper re-examines the genetic data and analytical approaches used in these studies of Jewish ancestry, and situates them in the context of historical, linguistic, and archaeological evidence from the Caucasus, Europe and the Near East. Based on this reanalysis, it appears not only that the Khazar Hypothesis per se is without serious merit, but also the veracity of the  Rhineland Hypothesis may also be questionable."
10.1101/001453,"The diversity of populations in domestic species offer great opportunities to study genome response to selection. The recently published Sheep Hapmap dataset is a great example of characterization of the world wide genetic diversity in the Sheep. In this study, we re-analyzed the Sheep Hapmap dataset to identify selection signatures in worldwide Sheep populations. Compared to previous analyses, we make use of statistical methods that (i) take account of the hierarchical structure of sheep populations, (ii) make use of Linkage Disequilibrium information and (iii) focus specifically on either recent or older selection signatures. We show that this allows to pinpoint several new selection signatures in the sheep genome and to distinguish those related to modern breeding objectives and to earlier post-domestication constraints. The newly identified regions, together with the one previously identified, reveal the extensive genome response to selection on morphology, color and adaptation to new environments."
10.1101/001552,"We sequenced genomes from a [~]7,000 year old early farmer from Stuttgart in Germany, an [~]8,000 year old hunter-gatherer from Luxembourg, and seven [~]8,000 year old hunter-gatherers from southern Sweden. We analyzed these data together with other ancient genomes and 2,345 contemporary humans to show that the great majority of present-day Europeans derive from at least three highly differentiated populations: West European Hunter-Gatherers (WHG), who contributed ancestry to all Europeans but not to Near Easterners; Ancient North Eurasians (ANE), who were most closely related to Upper Paleolithic Siberians and contributed to both Europeans and Near Easterners; and Early European Farmers (EEF), who were mainly of Near Eastern origin but also harbored WHG-related ancestry. We model these populations deep relationships and show that EEF had [~]44% ancestry from a \""Basal Eurasian\"" lineage that split prior to the diversification of all other non-African lineages."
10.1101/001347,"Several methods have been proposed to test for introgression across genomes. One method tests for a genome-wide excess of shared derived alleles between taxa using Pattersons D statistic, but does not establish which loci show such an excess or whether the excess is due to introgression or ancestral population structure. Several recent studies have extended the use of D by applying the statistic to small genomic regions, rather than genome-wide. Here, we use simulations and whole genome data from Heliconius butterflies to investigate the behavior of D in small genomic regions. We find that D is unreliable in this situation as it gives inflated values when effective population size is low, causing D outliers to cluster in genomic regions of reduced diversity. As an alternative, we propose a related statistic [Formula] a modified version of a statistic originally developed to estimate the genome-wide fraction of admixture. [Formula] is not subject to the same biases as D, and is better at identifying introgressed loci. Finally, we show that both D and [Formula] outliers tend to cluster in regions of low absolute divergence (dXY), which can confound a recently proposed test for differentiating introgression from shared ancestral variation at individual loci."
10.1101/001404,"Explaining the evolution of human life history characteristics remains an outstanding problem to evolutionary anthropologists. Progress is hindered by common misunderstandings of how selection works in age-structured populations. I review two important results of life history theory related to demography. First, different life history strategies evolve under density-independent and density-dependent population growth. Second, and more poorly appreciated, different kinds of density-dependence also select for different life history strategies; assuming zero population growth alone is insufficient to determine the optimal strategy. I show that these facts are more than methodological niceties by reanalyzing the model by Kaplan et al. (2000) and showing that the results depend strongly on the form of population regulation assumed. This analysis suggests that progress in human life history theory requires better understanding of the demography of our ancestors. I close with a discussion of empirical implications."
